{
  "protocol": "curve",
  "as_of": "2026-10-19",
  "income_statement": {
    "revenue": {
      "entity_type": "app",
      "revenue_included": {
        "admin_fee_usd_365d": 15605589,
        "vecrv_distribution_usd_365d": 15605589,
        "total_usd_365d": 15605589
      },
      "revenue_excluded": {
        "lp_share": {
          "note": "交易费 50% LP 分润不计入（收入按 admin fee 口径）"
        },
        "community_fund": {
          "note": "FeeAllocator 10% → Community Fund Treasury（约 $1733954/365d）不计入 DefiLlama dailyRevenue 口径"
        }
      },
      "growth_yoy_percent": null,
      "source": {
        "type": "chain",
        "url": "Community Fund Treasury crvUSD inflow × 9（FeeAllocator 90/10）+ DefiLlama dailyRevenue（本地 fee-history 缓存）"
      },
      "by_period": {
        "7d": {
          "total_usd": 535611.0
        },
        "30d": {
          "total_usd": 1706788.0
        },
        "90d": {
          "total_usd": 3881167.0
        },
        "365d": {
          "total_usd": 15605589
        }
      }
    },
    "gross_profit": {
      "lp_share_cost_usd_365d": null,
      "gross_profit_usd_365d": 15605589,
      "calculation_note": "收入按 admin fee 口径（交易费 50% LP / 50% admin，LP 分润已排除）→ 毛利 = 收入"
    },
    "token_emission_cost": {
      "usd_365d": 26000000,
      "annual_emission_tokens": 115500000,
      "inflation_rate_percent": 4.8,
      "treatment": "cost",
      "calculation_note": "CRV 年增发 ~1.155 亿（约 $26M/年）全流给 LP 挖矿（有对价换收入 → 作为成本从净利扣除，美股 SBC 类比）"
    },
    "net_income": {
      "net_income_usd_365d": -10394411,
      "operating_cost_usd_365d": null,
      "calculation_note": "净利 = 毛利 − 增发成本（美股 SBC 类比：CRV 增发全流 LP 挖矿，作为成本扣除）→ 净利为负（净稀释）"
    },
    "margins": {
      "gross_margin_percent": 100.0,
      "net_margin_percent": -66.607,
      "note": "净利为负：增发按成本扣除（CRV 增发 $26M/年 > admin fee 收入 $15.34M）→ 净稀释；毛利率口径性 100%（收入已排除 LP 分润）"
    }
  },
  "holder_returns": {
    "by_mechanism": [
      {
        "mechanism": "veCRV 分红（FeeAllocator 90% admin fee）",
        "type": "yield",
        "usd_365d": 15605589,
        "yield_percent": 2.768,
        "note": "90% admin fee 兑换 crvUSD 分给 veCRV 锁仓持有人（裸 CRV 不参与）；名义 yield = 股东回报 / CRV 全市值，实际锁仓持有人更高（veCRV-only 口径）"
      }
    ],
    "summary": {
      "destroy_usd_365d": null,
      "yield_usd_365d": 15605589,
      "destroy_yield_percent": null,
      "yield_yield_percent": 2.768,
      "shareholder_returns_usd_365d": 15605589,
      "shareholder_yield_percent": 2.768
    },
    "by_period": {
      "7d": {
        "revenue_usd": 535611.0,
        "shareholder_returns_usd": 535611.0,
        "destroy_usd": 535611.0,
        "yield_usd": 0.0,
        "shareholder_yield_percent": 4.9536,
        "buyback_yield_percent": 4.9536,
        "dividend_yield_percent": 0.0,
        "payout_ratio": 1.0,
        "status": "active",
        "source": "defillama"
      },
      "30d": {
        "revenue_usd": 1706788.0,
        "shareholder_returns_usd": 1706788.0,
        "destroy_usd": 1706788.0,
        "yield_usd": 0.0,
        "shareholder_yield_percent": 3.6832,
        "buyback_yield_percent": 3.6832,
        "dividend_yield_percent": 0.0,
        "payout_ratio": 1.0,
        "status": "active",
        "source": "defillama"
      },
      "90d": {
        "revenue_usd": 3881167.0,
        "shareholder_returns_usd": 3881167.0,
        "destroy_usd": 3881167.0,
        "yield_usd": 0.0,
        "shareholder_yield_percent": 2.7919,
        "buyback_yield_percent": 2.7919,
        "dividend_yield_percent": 0.0,
        "payout_ratio": 1.0,
        "status": "active",
        "source": "defillama"
      },
      "365d": {
        "revenue_usd": 15605589,
        "shareholder_returns_usd": 15605589,
        "destroy_usd": 15605589,
        "yield_usd": 0.0,
        "shareholder_yield_percent": 2.768,
        "buyback_yield_percent": 2.768,
        "dividend_yield_percent": 0.0,
        "payout_ratio": 1.0,
        "status": "active",
        "source": "defillama"
      }
    }
  },
  "balance_sheet": {
    "market_cap_usd": 563793629,
    "tvl_usd": 1808019756.5740514,
    "treasury_usd": null,
    "debt_usd": null
  },
  "valuation": {
    "pe": 36.1277,
    "ps": 36.1277,
    "pb": null,
    "ev_revenue": null,
    "payout_ratio": null
  },
  "verification": {
    "method": "FeeAllocator 90/10：Community Fund Treasury crvUSD inflow × 9 反推 veCRV TEV 365d=15605589 · 增发成本 26000000（config.token_emission_cost）",
    "status": "verified",
    "last_checked": "2026-10-19"
  }
}