{
  "protocol": "eigenlayer",
  "as_of": "2026-10-29",
  "income_statement": {
    "revenue": {
      "entity_type": "app",
      "revenue_included": {
        "protocol_fees_usd_365d": 0.0,
        "total_usd_365d": 0.0
      },
      "revenue_excluded": {
        "avs_fees": {
          "note": "AVS 费用全流向 operator/restaker（持 ETH/LST），EIGEN 无收入分配权；fee switch OFF"
        }
      },
      "growth_yoy_percent": null,
      "source": {
        "type": "defillama",
        "url": "https://defillama.com/protocol/eigenlayer"
      },
      "by_period": {
        "7d": {
          "total_usd": 0.0
        },
        "30d": {
          "total_usd": 0.0
        },
        "90d": {
          "total_usd": 0.0
        },
        "365d": {
          "total_usd": 0.0
        }
      }
    },
    "gross_profit": {
      "lp_share_cost_usd_365d": null,
      "gross_profit_usd_365d": 0.0,
      "calculation_note": "DefiLlama dailyRevenue 为协议净收入口径；当前 AVS 费用全流向 operator/restaker，协议端毛利 = 0"
    },
    "token_emission_cost": {
      "usd_365d": null,
      "annual_emission_tokens": null,
      "inflation_rate_percent": null,
      "treatment": "none",
      "calculation_note": "EIGEN 存在 unlock/再质押排放（无对价），但当前无协议收入模型，不涉及增发成本扣减"
    },
    "net_income": {
      "net_income_usd_365d": 0.0,
      "operating_cost_usd_365d": null,
      "calculation_note": "净利 = 收入 − 增发(0) − 运营成本(数据不可得)；协议无收入（AVS fee 归 operator/restaker），股东回报 = 0（治理代币）"
    },
    "margins": {
      "gross_margin_percent": null,
      "net_margin_percent": null,
      "note": "派生计算：收入为 0（协议端无收入），毛利率/净利率无意义（null）"
    }
  },
  "holder_returns": {
    "by_mechanism": [
      {
        "mechanism": "治理代币（无股东回报）",
        "type": "yield",
        "usd_365d": 0,
        "yield_percent": 0,
        "verified": "estimated",
        "note": "治理代币，无股东回报（不回购/不分红/不销毁）；AVS 费用全流向 operator/restaker，EIGEN 无收入分配权"
      }
    ],
    "summary": {
      "destroy_usd_365d": null,
      "yield_usd_365d": null,
      "destroy_yield_percent": null,
      "yield_yield_percent": null,
      "shareholder_returns_usd_365d": 0,
      "shareholder_yield_percent": 0
    },
    "by_period": {
      "7d": {
        "revenue_usd": 0.0,
        "shareholder_returns_usd": 0.0,
        "destroy_usd": 0.0,
        "yield_usd": 0.0,
        "shareholder_yield_percent": 0.0,
        "buyback_yield_percent": 0.0,
        "dividend_yield_percent": 0.0,
        "payout_ratio": null,
        "status": "none",
        "source": "official"
      },
      "30d": {
        "revenue_usd": 0.0,
        "shareholder_returns_usd": 0.0,
        "destroy_usd": 0.0,
        "yield_usd": 0.0,
        "shareholder_yield_percent": 0.0,
        "buyback_yield_percent": 0.0,
        "dividend_yield_percent": 0.0,
        "payout_ratio": null,
        "status": "none",
        "source": "official"
      },
      "90d": {
        "revenue_usd": 0.0,
        "shareholder_returns_usd": 0.0,
        "destroy_usd": 0.0,
        "yield_usd": 0.0,
        "shareholder_yield_percent": 0.0,
        "buyback_yield_percent": 0.0,
        "dividend_yield_percent": 0.0,
        "payout_ratio": null,
        "status": "none",
        "source": "official"
      },
      "365d": {
        "revenue_usd": 0.0,
        "shareholder_returns_usd": 0.0,
        "destroy_usd": 0.0,
        "yield_usd": 0.0,
        "shareholder_yield_percent": 0.0,
        "buyback_yield_percent": 0.0,
        "dividend_yield_percent": 0.0,
        "payout_ratio": null,
        "status": "none",
        "source": "official"
      }
    }
  },
  "balance_sheet": {
    "market_cap_usd": 196655519,
    "tvl_usd": 8717705308.933592,
    "treasury_usd": null,
    "debt_usd": null
  },
  "valuation": {
    "pe": null,
    "ps": null,
    "pb": null,
    "ev_revenue": null,
    "payout_ratio": null
  },
  "verification": {
    "method": "DefiLlama dailyRevenue 365d = $0（AVS 费用流向 operator/restaker，协议端无收入）；EIGEN 治理代币不回购（fee switch OFF）；restaking rewards 全流向 validator",
    "status": "estimated",
    "last_checked": "2026-10-29"
  }
}