{
  "protocol": "pancakeswap",
  "as_of": "2026-10-31",
  "income_statement": {
    "revenue": {
      "entity_type": "app",
      "revenue_included": {
        "protocol_fees_usd_365d": 94063758.4,
        "buyback_burn_usd_365d": 58789849,
        "total_usd_365d": 94063758.4
      },
      "revenue_excluded": {
        "lp_share": {
          "note": "总费用 N/A 中 LP 分润 N/A（~65%）不计入（收入按协议收入口径）"
        },
        "gas_fees": {
          "note": "链上 gas 手续费不计入（交易费口径已含 buyback 路由部分）"
        }
      },
      "growth_yoy_percent": null,
      "source": {
        "type": "defillama",
        "url": "DefiLlama dailyHoldersRevenue（CAKE buyback&burn）+ daily/latest.json total1y_fees + docs.pancakeswap.finance/cake-tokenomics"
      },
      "by_period": {
        "7d": {
          "total_usd": 681540.93
        },
        "30d": {
          "total_usd": 3814517.4
        },
        "90d": {
          "total_usd": 17292732.42
        },
        "365d": {
          "total_usd": 94063758.4
        }
      }
    },
    "gross_profit": {
      "lp_share_cost_usd_365d": null,
      "gross_profit_usd_365d": 94063758.4,
      "calculation_note": "收入 = 协议收入（总费用 N/A − LP 分润 N/A）；回购销毁 $58,789,849 ≈ 总费用 22% / 协议收入 60-65%（payout_ratio 0.625）→ 毛利 = 协议收入"
    },
    "token_emission_cost": {
      "usd_365d": 11700000,
      "annual_emission_tokens": 8212500,
      "inflation_rate_percent": 3.2,
      "treatment": "cost",
      "calculation_note": "日增发 4万→2.25 万 CAKE（farm 激励，有对价换收入 → 成本）；增发 $11.7M < 回购销毁 ~$18M → 净利为正（净通缩，连续 34 个月）"
    },
    "net_income": {
      "net_income_usd_365d": 82363758.4,
      "operating_cost_usd_365d": null,
      "calculation_note": "净利 = 收入 − LP − 增发成本 = $94,063,758 − N/A − $11,700,000 = $82,363,758；增发按成本（farm 激励有对价换收入，美股 SBC 类比）；增发 $11,700,000 < 回购销毁 $58,789,849 → 净利为正（净通缩，连续 34 个月）"
    },
    "margins": {
      "gross_margin_percent": 100.0,
      "net_margin_percent": 87.5616,
      "note": "收入按协议收入口径（LP 分润已排除）→ 毛利率口径性 100%；净利率 = 净利/收入（增发按成本扣除）→ 净利为正（净通缩）"
    }
  },
  "holder_returns": {
    "by_mechanism": [
      {
        "mechanism": "CAKE 回购销毁（Tokenomics 3.0）",
        "type": "destroy",
        "usd_365d": 58789849,
        "yield_percent": 8.8844,
        "note": "现货 15-23%、永续 20%、CAKE.PAD 100% 等产品 fee 路由去回购销毁（DefiLlama dailyHoldersRevenue，gross 口径）；CAKE → 0x000...dEaD 链上可验证；≈ 总费用 22% / 协议收入 60-65% 🟢"
      }
    ],
    "summary": {
      "destroy_usd_365d": 58789849,
      "yield_usd_365d": null,
      "destroy_yield_percent": 8.8844,
      "yield_yield_percent": null,
      "shareholder_returns_usd_365d": 58789849,
      "shareholder_yield_percent": 8.8844
    },
    "by_period": {
      "7d": {
        "revenue_usd": 681540.93,
        "shareholder_returns_usd": 399271,
        "destroy_usd": 399271,
        "yield_usd": 0,
        "shareholder_yield_percent": 3.1462,
        "buyback_yield_percent": 3.1462,
        "dividend_yield_percent": 0.0,
        "payout_ratio": 0.5858,
        "status": "active",
        "source": "chain"
      },
      "30d": {
        "revenue_usd": 3814517.4,
        "shareholder_returns_usd": 1380342,
        "destroy_usd": 1380342,
        "yield_usd": 0,
        "shareholder_yield_percent": 2.5379,
        "buyback_yield_percent": 2.5379,
        "dividend_yield_percent": 0.0,
        "payout_ratio": 0.3619,
        "status": "active",
        "source": "chain"
      },
      "90d": {
        "revenue_usd": 17292732.42,
        "shareholder_returns_usd": 5678619,
        "destroy_usd": 5678619,
        "yield_usd": 0,
        "shareholder_yield_percent": 3.4803,
        "buyback_yield_percent": 3.4803,
        "dividend_yield_percent": 0.0,
        "payout_ratio": 0.3284,
        "status": "active",
        "source": "chain"
      },
      "365d": {
        "revenue_usd": 94063758.4,
        "shareholder_returns_usd": 58789849,
        "destroy_usd": 58789849,
        "yield_usd": 0,
        "shareholder_yield_percent": 8.8844,
        "buyback_yield_percent": 8.8844,
        "dividend_yield_percent": 0.0,
        "payout_ratio": 0.625,
        "status": "active",
        "source": "chain"
      }
    }
  },
  "balance_sheet": {
    "market_cap_usd": 661723086,
    "tvl_usd": 2063271713.806489,
    "treasury_usd": null,
    "debt_usd": null
  },
  "valuation": {
    "pe": 11.2557,
    "ps": 7.0348,
    "pb": null,
    "ev_revenue": null,
    "payout_ratio": 0.7138
  },
  "verification": {
    "method": "回购销毁 365d $58,789,849（DefiLlama dailyHoldersRevenue，burn-history.json）× payout_ratio 0.625 反推协议收入 $94,063,758（判定书 60-65%，现货 15-23%/永续 20%/CAKE.PAD 100%）；增发成本 $11,700,000（config.token_emission_cost，treatment=cost）；净利 $82,363,758（正，净通缩）",
    "status": "verified",
    "last_checked": "2026-10-31"
  }
}