{
  "protocol": "bgb",
  "as_of": "2026-10-29",
  "income_statement": {
    "revenue": {
      "entity_type": "platform_token",
      "revenue_included": {
        "burn_usd_365d": 27700000,
        "staking_rewards_usd_365d": null,
        "launchpad_launchpool_usd_365d": null,
        "total_usd_365d": 27700000
      },
      "revenue_excluded": {
        "launchpad": {
          "note": "Bitget 基本没有打新，不计入"
        }
      },
      "growth_yoy_percent": null,
      "source": {
        "type": "official",
        "url": "https://www.bitget.com/bgb"
      },
      "by_period": {
        "7d": {
          "total_usd": null
        },
        "30d": {
          "total_usd": null
        },
        "90d": {
          "total_usd": null
        },
        "365d": {
          "total_usd": null
        }
      }
    },
    "gross_profit": {
      "lp_share_cost_usd_365d": null,
      "gross_profit_usd_365d": 27700000,
      "calculation_note": "平台币无 LP 分润成本，毛利 = 收入（季度回购销毁年化）"
    },
    "token_emission_cost": {
      "usd_365d": null,
      "annual_emission_tokens": null,
      "inflation_rate_percent": null,
      "treatment": "none",
      "calculation_note": "BGB 无持续增发（2024-12 一次性销毁 8 亿后总供应 12 亿，100% 全流通），不涉及增发成本"
    },
    "net_income": {
      "net_income_usd_365d": 27700000,
      "operating_cost_usd_365d": null,
      "calculation_note": "平台币：净利 = 收入 = 股东回报（季度回购销毁口径，无成本模型）"
    },
    "margins": {
      "gross_margin_percent": 100.0,
      "net_margin_percent": 100.0,
      "note": "平台币无成本模型，毛利率/净利率 = 100%（口径标注，非经营性利润）"
    }
  },
  "holder_returns": {
    "by_mechanism": [
      {
        "mechanism": "季度回购销毁（Morph 链费挂钩，2025-11 起）",
        "type": "buyback",
        "usd_365d": 27700000,
        "yield_percent": 2.1108,
        "note": "⚠️ 2025-11 机制变更：从「利润 20%」改为挂钩 Morph 链 Gas 费（boost ~1100-1400×），销毁额骤降 90%。2026 Q1 ~$807 万 / Q2 ~$578 万，年化 ~$2,770 万（旧口径 $5.2 亿基于 2025 一次性事件，已弃用）"
      }
    ],
    "summary": {
      "destroy_usd_365d": 27700000,
      "yield_usd_365d": null,
      "destroy_yield_percent": 2.1108,
      "yield_yield_percent": null,
      "shareholder_returns_usd_365d": 27700000,
      "shareholder_yield_percent": 2.1108
    },
    "by_period": {
      "7d": {
        "revenue_usd": null,
        "shareholder_returns_usd": null,
        "destroy_usd": null,
        "yield_usd": null,
        "shareholder_yield_percent": null,
        "buyback_yield_percent": null,
        "dividend_yield_percent": null,
        "payout_ratio": null,
        "status": "none",
        "source": "none"
      },
      "30d": {
        "revenue_usd": null,
        "shareholder_returns_usd": null,
        "destroy_usd": null,
        "yield_usd": null,
        "shareholder_yield_percent": null,
        "buyback_yield_percent": null,
        "dividend_yield_percent": null,
        "payout_ratio": null,
        "status": "none",
        "source": "none"
      },
      "90d": {
        "revenue_usd": null,
        "shareholder_returns_usd": null,
        "destroy_usd": null,
        "yield_usd": null,
        "shareholder_yield_percent": null,
        "buyback_yield_percent": null,
        "dividend_yield_percent": null,
        "payout_ratio": null,
        "status": "none",
        "source": "none"
      },
      "365d": {
        "revenue_usd": null,
        "shareholder_returns_usd": null,
        "destroy_usd": null,
        "yield_usd": null,
        "shareholder_yield_percent": null,
        "buyback_yield_percent": null,
        "dividend_yield_percent": null,
        "payout_ratio": null,
        "status": "none",
        "source": "none"
      }
    }
  },
  "balance_sheet": {
    "market_cap_usd": 1312313042,
    "tvl_usd": 0,
    "treasury_usd": null,
    "debt_usd": null
  },
  "valuation": {
    "pe": 47.3759,
    "ps": 47.3759,
    "pb": null,
    "ev_revenue": null,
    "payout_ratio": 1.0
  },
  "verification": {
    "method": "官方季度公告（2025 Q1/Q2 各销毁 ~3000 万枚 / $1.2-1.4 亿季度）年化 + 链上销毁地址 0x000...000 复核",
    "status": "partial",
    "last_checked": "2026-10-29"
  }
}