{
  "protocol": "layerzero",
  "as_of": "2026-10-31",
  "income_statement": {
    "revenue": {
      "entity_type": "app",
      "revenue_included": {
        "protocol_fees_usd_365d": 0,
        "stargate_fees_usd_365d": 3391193.0,
        "total_usd_365d": 3391193.0
      },
      "revenue_excluded": {
        "protocol_fees": {
          "note": "协议本体消息费 0% take rate（$3.59M 流向 DVN/Executor 外部节点外包成本）；fee switch 未开启（半年公投多次未过）"
        }
      },
      "growth_yoy_percent": null,
      "source": {
        "type": "chain",
        "url": "https://etherscan.io"
      },
      "by_period": {
        "7d": {
          "total_usd": 0.0
        },
        "30d": {
          "total_usd": 0.0
        },
        "90d": {
          "total_usd": 322682.0
        },
        "365d": {
          "total_usd": 3391193.0
        }
      }
    },
    "gross_profit": {
      "lp_share_cost_usd_365d": 2283833.64,
      "gross_profit_usd_365d": 784677.36,
      "calculation_note": "Stargate 收入中 $2.28M 流向 supply-side（DVN/Executor 外包成本），归协议 ≈ $0.78M（毛利极薄）"
    },
    "token_emission_cost": {
      "usd_365d": null,
      "annual_emission_tokens": null,
      "inflation_rate_percent": null,
      "treatment": "dilution_note",
      "calculation_note": "每月解锁 ~$48M（2027 年中前持续）——无对价解锁，不算成本但必须标注（财报页强制展示）；回购月 ~$150K 远不足以对冲"
    },
    "net_income": {
      "net_income_usd_365d": 784677.36,
      "operating_cost_usd_365d": null,
      "calculation_note": "净利 = 毛利 − 增发成本(0，稀释注记) − 运营成本(数据不可得)；归协议 ≈ $0.78M"
    },
    "margins": {
      "gross_margin_percent": 23.1387,
      "net_margin_percent": 23.1387,
      "note": "派生计算：毛利极薄（supply-side 外包成本占比高）；gross = GP/Rev"
    }
  },
  "holder_returns": {
    "by_mechanism": [
      {
        "mechanism": "Stargate 收入回购 ZRO（100%）",
        "type": "buyback",
        "usd_365d": 784539.21,
        "yield_percent": 0.129,
        "verified": "partial",
        "note": "2026-03 起 100% Stargate 收入回购 ZRO（累计 149.5 万 ZRO/$3.14M，链上可验证）；协议本体 fee switch 未开启 → 股东回报极低（0.3%）"
      }
    ],
    "summary": {
      "destroy_usd_365d": 784539.21,
      "yield_usd_365d": null,
      "destroy_yield_percent": 0.129,
      "yield_yield_percent": null,
      "shareholder_returns_usd_365d": 784539.21,
      "shareholder_yield_percent": 0.129
    },
    "by_period": {
      "7d": {
        "revenue_usd": 0.0,
        "shareholder_returns_usd": 0.0,
        "destroy_usd": 0.0,
        "yield_usd": 0.0,
        "shareholder_yield_percent": 0.0,
        "buyback_yield_percent": 0.0,
        "dividend_yield_percent": 0.0,
        "payout_ratio": null,
        "status": "active",
        "source": "defillama"
      },
      "30d": {
        "revenue_usd": 0.0,
        "shareholder_returns_usd": 0.0,
        "destroy_usd": 0.0,
        "yield_usd": 0.0,
        "shareholder_yield_percent": 0.0,
        "buyback_yield_percent": 0.0,
        "dividend_yield_percent": 0.0,
        "payout_ratio": null,
        "status": "active",
        "source": "defillama"
      },
      "90d": {
        "revenue_usd": 322682.0,
        "shareholder_returns_usd": 74651.22,
        "destroy_usd": 74651.22,
        "yield_usd": 0.0,
        "shareholder_yield_percent": 0.0498,
        "buyback_yield_percent": 0.0498,
        "dividend_yield_percent": 0.0,
        "payout_ratio": 0.2313,
        "status": "active",
        "source": "defillama"
      },
      "365d": {
        "revenue_usd": 3391193.0,
        "shareholder_returns_usd": 784539.21,
        "destroy_usd": 784539.21,
        "yield_usd": 0.0,
        "shareholder_yield_percent": 0.129,
        "buyback_yield_percent": 0.129,
        "dividend_yield_percent": 0.0,
        "payout_ratio": 0.2313,
        "status": "active",
        "source": "defillama"
      }
    }
  },
  "balance_sheet": {
    "market_cap_usd": 607956814,
    "tvl_usd": 7500000000,
    "treasury_usd": null,
    "debt_usd": null
  },
  "valuation": {
    "pe": 774.9222,
    "ps": 179.2752,
    "pb": null,
    "ev_revenue": null,
    "payout_ratio": 0.9998
  },
  "verification": {
    "method": "收入 = Stargate 收入 365d $3,391,193（协议本体 0，fee switch OFF）；股东回报 = Stargate 回购 $784,539（100% Stargate 收入，累计 149.5 万 ZRO/$3.14M）；稀释注记：每月解锁 ~$48M（2027 年中前）；观察点：费用开关半年公投",
    "status": "partial",
    "last_checked": "2026-10-31"
  }
}