{
  "protocol": "bnb",
  "as_of": "2026-10-27",
  "income_statement": {
    "revenue": {
      "entity_type": "platform_token",
      "revenue_included": {
        "burn_usd_365d": 4469070272.24,
        "staking_rewards_usd_365d": 1668525133.34,
        "launchpad_launchpool_usd_365d": null,
        "total_usd_365d": 6137595405.58
      },
      "revenue_excluded": {
        "fees": {
          "note": "gas 手续费不计入（BEP-95 销毁部分已含于 burn 科目）"
        }
      },
      "growth_yoy_percent": null,
      "by_period": {
        "7d": {
          "total_usd": 117378766.12
        },
        "30d": {
          "total_usd": 504223802.25
        },
        "90d": {
          "total_usd": 1514537185.31
        },
        "365d": {
          "total_usd": 6137595405.58
        }
      },
      "source": {
        "type": "chain",
        "url": "0xdead 链上 + StakeHub asBNB APY（本地 burn-history/bep95-history 缓存）"
      }
    },
    "gross_profit": {
      "lp_share_cost_usd_365d": null,
      "gross_profit_usd_365d": 6137595405.58,
      "calculation_note": "平台币无 LP 分润成本，毛利 = 收入（赋能总额）"
    },
    "token_emission_cost": {
      "usd_365d": null,
      "annual_emission_tokens": null,
      "inflation_rate_percent": null,
      "treatment": "none",
      "calculation_note": "BNB 无代币增发（总供应递减：Auto-Burn 目标 100M），不涉及增发成本"
    },
    "net_income": {
      "net_income_usd_365d": 6137595405.58,
      "operating_cost_usd_365d": null,
      "calculation_note": "平台币：净利 = 收入 = 股东回报（赋能口径，无成本模型）"
    },
    "margins": {
      "gross_margin_percent": 100.0,
      "net_margin_percent": 100.0,
      "note": "平台币无成本模型，毛利率/净利率 = 100%（口径标注，非经营性利润）"
    }
  },
  "holder_returns": {
    "by_mechanism": [
      {
        "mechanism": "Auto-Burn（季度）",
        "type": "destroy",
        "usd_365d": 4451939100.0,
        "yield_percent": 4.5626
      },
      {
        "mechanism": "BEP-95 实时销毁",
        "type": "destroy",
        "usd_365d": 17131172.24,
        "yield_percent": 0.0176
      },
      {
        "mechanism": "aBNB 打新+质押",
        "type": "yield",
        "usd_365d": 1668525133.34,
        "yield_percent": 1.71
      }
    ],
    "summary": {
      "destroy_usd_365d": 4469070272.24,
      "yield_usd_365d": 1668525133.34,
      "destroy_yield_percent": 4.5802,
      "yield_yield_percent": 1.71,
      "shareholder_returns_usd_365d": 6137595405.58,
      "shareholder_yield_percent": 6.2902
    },
    "by_period": {
      "7d": {
        "revenue_usd": 117378766.12,
        "shareholder_returns_usd": 117378766.12,
        "destroy_usd": 85379653.97,
        "yield_usd": 31999112.15,
        "shareholder_yield_percent": 6.2726,
        "buyback_yield_percent": 4.5626,
        "dividend_yield_percent": 1.71,
        "payout_ratio": 1.0,
        "status": "active",
        "source": "chain"
      },
      "30d": {
        "revenue_usd": 504223802.25,
        "shareholder_returns_usd": 504223802.25,
        "destroy_usd": 367084750.19,
        "yield_usd": 137139052.06,
        "shareholder_yield_percent": 6.2872,
        "buyback_yield_percent": 4.5772,
        "dividend_yield_percent": 1.71,
        "payout_ratio": 1.0,
        "status": "active",
        "source": "chain"
      },
      "90d": {
        "revenue_usd": 1514537185.31,
        "shareholder_returns_usd": 1514537185.31,
        "destroy_usd": 1103120029.14,
        "yield_usd": 411417156.17,
        "shareholder_yield_percent": 6.295,
        "buyback_yield_percent": 4.585,
        "dividend_yield_percent": 1.71,
        "payout_ratio": 1.0,
        "status": "active",
        "source": "chain"
      },
      "365d": {
        "revenue_usd": 6137595405.58,
        "shareholder_returns_usd": 6137595405.58,
        "destroy_usd": 4469070272.24,
        "yield_usd": 1668525133.34,
        "shareholder_yield_percent": 6.2902,
        "buyback_yield_percent": 4.5802,
        "dividend_yield_percent": 1.71,
        "payout_ratio": 1.0,
        "status": "active",
        "source": "chain"
      }
    }
  },
  "balance_sheet": {
    "market_cap_usd": 97574569201,
    "tvl_usd": 5387604237.313377,
    "treasury_usd": null,
    "debt_usd": null
  },
  "valuation": {
    "pe": 15.8978,
    "ps": 15.8978,
    "pb": null,
    "ev_revenue": null,
    "payout_ratio": 1.0
  },
  "verification": {
    "method": "Auto-Burn 近4季 5998220.315 BNB + BEP-95 日序列 585 天（剔除季度大额销毁）+ asBNB APY 1.71%",
    "status": "verified",
    "last_checked": "2026-10-27"
  }
}