{
  "protocol": "fluid",
  "as_of": "2026-10-21",
  "income_statement": {
    "revenue": {
      "entity_type": "app",
      "revenue_included": {
        "protocol_fees_usd_365d": 10003144.84,
        "total_usd_365d": 10003144.84
      },
      "revenue_excluded": {
        "lending_fees_to_lp": {
          "note": "借贷/DEX 费用给 LP 部分已在 DefiLlama dailyHoldersRevenue 口径内扣减；回购额 ≈ 收入 $12.85M × 35%"
        }
      },
      "growth_yoy_percent": null,
      "source": {
        "type": "defillama",
        "url": "https://defillama.com/protocol/fluid"
      },
      "by_period": {
        "7d": {
          "total_usd": 149869.0
        },
        "30d": {
          "total_usd": 732200.0
        },
        "90d": {
          "total_usd": 2009621.6
        },
        "365d": {
          "total_usd": 10003144.84
        }
      }
    },
    "gross_profit": {
      "lp_share_cost_usd_365d": null,
      "gross_profit_usd_365d": 10003144.84,
      "calculation_note": "DefiLlama dailyHoldersRevenue 为协议净收入口径（LP 分润已扣），毛利 = 收入"
    },
    "token_emission_cost": {
      "usd_365d": null,
      "annual_emission_tokens": null,
      "inflation_rate_percent": null,
      "treatment": "none",
      "calculation_note": "FLUID 无持续增发成本模型（供应 10 亿，回购进 reserve 钱包）"
    },
    "net_income": {
      "net_income_usd_365d": 10003144.84,
      "operating_cost_usd_365d": null,
      "calculation_note": "净利 = 收入 − 增发(0) − 运营成本(数据不可得)；35% 用于回购（= 净利口径），其余留存/支出"
    },
    "margins": {
      "gross_margin_percent": 100.0,
      "net_margin_percent": 100.0,
      "note": "派生计算：gross = GP/Rev, net = NI/Rev；协议收入为净额口径，故为 100%"
    }
  },
  "holder_returns": {
    "by_mechanism": [
      {
        "mechanism": "Fluid Reserve Buyback（35% 收入回购）",
        "type": "buyback",
        "usd_365d": 10003144.84,
        "yield_percent": 4.9601,
        "verified": "partial",
        "note": "2025-10 起 35% 收入 → Treasury 回购 FLUID（reserve 钱包 0x3e6F.../0x9Afb...，链上可追踪）；回购后终极用途未公开（储备/burn/分配待定）；35% 比例无链上治理投票"
      }
    ],
    "summary": {
      "destroy_usd_365d": 10003144.84,
      "yield_usd_365d": null,
      "destroy_yield_percent": 4.9601,
      "yield_yield_percent": null,
      "shareholder_returns_usd_365d": 10003144.84,
      "shareholder_yield_percent": 4.9601
    },
    "by_period": {
      "7d": {
        "revenue_usd": 149869.0,
        "shareholder_returns_usd": 149869.0,
        "destroy_usd": 149869.0,
        "yield_usd": 0.0,
        "shareholder_yield_percent": 3.8749,
        "buyback_yield_percent": 3.8749,
        "dividend_yield_percent": 0.0,
        "payout_ratio": 1.0,
        "status": "active",
        "source": "defillama"
      },
      "30d": {
        "revenue_usd": 732200.0,
        "shareholder_returns_usd": 732200.0,
        "destroy_usd": 732200.0,
        "yield_usd": 0.0,
        "shareholder_yield_percent": 4.4172,
        "buyback_yield_percent": 4.4172,
        "dividend_yield_percent": 0.0,
        "payout_ratio": 1.0,
        "status": "active",
        "source": "defillama"
      },
      "90d": {
        "revenue_usd": 2009621.6,
        "shareholder_returns_usd": 2009621.6,
        "destroy_usd": 2009621.6,
        "yield_usd": 0.0,
        "shareholder_yield_percent": 4.0412,
        "buyback_yield_percent": 4.0412,
        "dividend_yield_percent": 0.0,
        "payout_ratio": 1.0,
        "status": "active",
        "source": "defillama"
      },
      "365d": {
        "revenue_usd": 10003144.84,
        "shareholder_returns_usd": 10003144.84,
        "destroy_usd": 10003144.84,
        "yield_usd": 0.0,
        "shareholder_yield_percent": 4.9601,
        "buyback_yield_percent": 4.9601,
        "dividend_yield_percent": 0.0,
        "payout_ratio": 1.0,
        "status": "active",
        "source": "defillama"
      }
    }
  },
  "balance_sheet": {
    "market_cap_usd": 201673977,
    "tvl_usd": 858549305.8980845,
    "treasury_usd": null,
    "debt_usd": null
  },
  "valuation": {
    "pe": 20.1611,
    "ps": 20.1611,
    "pb": null,
    "ev_revenue": null,
    "payout_ratio": 1.0
  },
  "verification": {
    "method": "股东回报 = DefiLlama dailyHoldersRevenue 365d $10,003,145（= 35% 收入回购）；链上 reserve 钱包实测 $4,613,558（tev-records，差 <0.5%）",
    "status": "partial",
    "last_checked": "2026-10-21"
  }
}