{
  "protocol": "spark",
  "as_of": "2026-10-28",
  "income_statement": {
    "revenue": {
      "entity_type": "app",
      "revenue_included": {
        "protocol_fees_usd_365d": 9021723.0,
        "total_usd_365d": 9021723.0
      },
      "revenue_excluded": {
        "flow_to_sky_dao": {
          "note": "Spark 收入流向 Sky 主 DAO（Smart Burn Engine 回购 SKY），非 SPK 持有人；SPK 无股东回报"
        }
      },
      "growth_yoy_percent": null,
      "source": {
        "type": "defillama",
        "url": "https://defillama.com/protocol/spark"
      },
      "by_period": {
        "7d": {
          "total_usd": 177655.0
        },
        "30d": {
          "total_usd": 883787.0
        },
        "90d": {
          "total_usd": 2461725.0
        },
        "365d": {
          "total_usd": 9021723.0
        }
      }
    },
    "gross_profit": {
      "lp_share_cost_usd_365d": null,
      "gross_profit_usd_365d": 9021723.0,
      "calculation_note": "DefiLlama dailyRevenue 为协议净收入口径（LP 分润已在数据源扣减），毛利 = 收入"
    },
    "token_emission_cost": {
      "usd_365d": null,
      "annual_emission_tokens": null,
      "inflation_rate_percent": null,
      "treatment": "none",
      "calculation_note": "SPK 为 Sky SubDAO 代币（2024-Q3 启动），存在排放但无对价收入模型，不涉及增发成本扣减"
    },
    "net_income": {
      "net_income_usd_365d": 9021723.0,
      "operating_cost_usd_365d": null,
      "calculation_note": "净利 = 收入 − 增发(0) − 运营成本(数据不可得)；Spark 收入流向 Sky 主 DAO，SPK 本身股东回报 = 0（治理代币）"
    },
    "margins": {
      "gross_margin_percent": 100.0,
      "net_margin_percent": 100.0,
      "note": "派生计算：gross = GP/Rev, net = NI/Rev；协议收入为净额口径，故为 100%"
    }
  },
  "holder_returns": {
    "by_mechanism": [
      {
        "mechanism": "治理代币（无股东回报）",
        "type": "yield",
        "usd_365d": 0,
        "yield_percent": 0,
        "verified": "estimated",
        "note": "治理代币，无股东回报（不回购/不分红/不销毁）；Spark 收入归 Sky 主 DAO（Smart Burn Engine 回购 SKY），SPK 仅 SubDAO 治理"
      }
    ],
    "summary": {
      "destroy_usd_365d": null,
      "yield_usd_365d": null,
      "destroy_yield_percent": null,
      "yield_yield_percent": null,
      "shareholder_returns_usd_365d": 0,
      "shareholder_yield_percent": 0
    },
    "by_period": {
      "7d": {
        "revenue_usd": 177655.0,
        "shareholder_returns_usd": 0.0,
        "destroy_usd": 0.0,
        "yield_usd": 0.0,
        "shareholder_yield_percent": 0.0,
        "buyback_yield_percent": 0.0,
        "dividend_yield_percent": 0.0,
        "payout_ratio": 0.0,
        "status": "none",
        "source": "official"
      },
      "30d": {
        "revenue_usd": 883787.0,
        "shareholder_returns_usd": 0.0,
        "destroy_usd": 0.0,
        "yield_usd": 0.0,
        "shareholder_yield_percent": 0.0,
        "buyback_yield_percent": 0.0,
        "dividend_yield_percent": 0.0,
        "payout_ratio": 0.0,
        "status": "none",
        "source": "official"
      },
      "90d": {
        "revenue_usd": 2461725.0,
        "shareholder_returns_usd": 0.0,
        "destroy_usd": 0.0,
        "yield_usd": 0.0,
        "shareholder_yield_percent": 0.0,
        "buyback_yield_percent": 0.0,
        "dividend_yield_percent": 0.0,
        "payout_ratio": 0.0,
        "status": "none",
        "source": "official"
      },
      "365d": {
        "revenue_usd": 9021723.0,
        "shareholder_returns_usd": 0.0,
        "destroy_usd": 0.0,
        "yield_usd": 0.0,
        "shareholder_yield_percent": 0.0,
        "buyback_yield_percent": 0.0,
        "dividend_yield_percent": 0.0,
        "payout_ratio": 0.0,
        "status": "none",
        "source": "official"
      }
    }
  },
  "balance_sheet": {
    "market_cap_usd": 62508074,
    "tvl_usd": 5328898278.33737,
    "treasury_usd": null,
    "debt_usd": null
  },
  "valuation": {
    "pe": null,
    "ps": 6.9286,
    "pb": null,
    "ev_revenue": null,
    "payout_ratio": null
  },
  "verification": {
    "method": "净利 = DefiLlama dailyRevenue 365d $9,021,723（协议净收入）；SPK 治理代币不回购——收入流向 Sky 主 DAO 回购 SKY；SPK 股东回报 = 0",
    "status": "estimated",
    "last_checked": "2026-10-28"
  }
}