{
  "protocol": "maple",
  "as_of": "2026-10-18",
  "income_statement": {
    "revenue": {
      "entity_type": "app",
      "revenue_included": {
        "protocol_fees_usd_365d": 15480000,
        "total_usd_365d": 15480000
      },
      "revenue_excluded": {
        "ssf_treasury_reserve": {
          "note": "回购金额中留作国库储备/流动性的部分非直接股东回报（比例未披露，partial）"
        }
      },
      "growth_yoy_percent": null,
      "source": {
        "type": "official",
        "url": "maple.finance/transparency 官方仪表盘（月收入 ~$1.29M）+ MIP-021 治理提案（2026-07-17）"
      },
      "by_period": {
        "7d": {
          "total_usd": 214177.0
        },
        "30d": {
          "total_usd": 1335514.0
        },
        "90d": {
          "total_usd": 3627105.0
        },
        "365d": {
          "total_usd": 15480000
        }
      }
    },
    "gross_profit": {
      "lp_share_cost_usd_365d": null,
      "gross_profit_usd_365d": 15480000,
      "calculation_note": "机构借贷利差收入（无 LP 分润成本）→ 毛利 = 收入"
    },
    "token_emission_cost": {
      "usd_365d": null,
      "annual_emission_tokens": null,
      "inflation_rate_percent": null,
      "treatment": "none",
      "calculation_note": "SYRUP 总供应固定（~12.16B，2024 年由 MPL 迁移），无持续增发成本"
    },
    "net_income": {
      "net_income_usd_365d": 15480000,
      "operating_cost_usd_365d": null,
      "calculation_note": "净利 = 收入（毛利 − 增发成本 0）→ 回购 $1,548,000（10% 档）→ 留存 $13,932,000"
    },
    "margins": {
      "gross_margin_percent": 100.0,
      "net_margin_percent": 100.0,
      "note": "机构借贷利差口径（无 LP 分润）→ 毛利率/净利率 = 100%（口径标注）；净利留存 90%，回购 10%"
    }
  },
  "holder_returns": {
    "by_mechanism": [
      {
        "mechanism": "MIP-021 阶梯回购（SSF）",
        "type": "buyback",
        "usd_365d": 1548000.0,
        "yield_percent": 0.6622,
        "note": "月收入 $1,290,000 < $1.5M → 10% 档；MIP-021（2026-07-17 通过 99.97%）回购规则化，首次执行 2026-08；MIP-019/020 固定 25% 已于 2026-Q2 结束；SSF 国库地址未公开、burn vs reserve 比例未披露 → partial"
      }
    ],
    "summary": {
      "destroy_usd_365d": 1548000.0,
      "yield_usd_365d": null,
      "destroy_yield_percent": 0.6622,
      "yield_yield_percent": null,
      "shareholder_returns_usd_365d": 1548000.0,
      "shareholder_yield_percent": 0.6622
    },
    "by_period": {
      "7d": {
        "revenue_usd": 214177.0,
        "shareholder_returns_usd": 21417.7,
        "destroy_usd": 21417.7,
        "yield_usd": 0.0,
        "shareholder_yield_percent": 0.4778,
        "buyback_yield_percent": 0.4778,
        "dividend_yield_percent": 0.0,
        "payout_ratio": 0.1,
        "status": "active",
        "source": "defillama"
      },
      "30d": {
        "revenue_usd": 1335514.0,
        "shareholder_returns_usd": 133551.4,
        "destroy_usd": 133551.4,
        "yield_usd": 0.0,
        "shareholder_yield_percent": 0.6951,
        "buyback_yield_percent": 0.6951,
        "dividend_yield_percent": 0.0,
        "payout_ratio": 0.1,
        "status": "active",
        "source": "defillama"
      },
      "90d": {
        "revenue_usd": 3627105.0,
        "shareholder_returns_usd": 362710.5,
        "destroy_usd": 362710.5,
        "yield_usd": 0.0,
        "shareholder_yield_percent": 0.6293,
        "buyback_yield_percent": 0.6293,
        "dividend_yield_percent": 0.0,
        "payout_ratio": 0.1,
        "status": "active",
        "source": "defillama"
      },
      "365d": {
        "revenue_usd": 15480000,
        "shareholder_returns_usd": 1548000.0,
        "destroy_usd": 1548000.0,
        "yield_usd": 0.0,
        "shareholder_yield_percent": 0.6622,
        "buyback_yield_percent": 0.6622,
        "dividend_yield_percent": 0.0,
        "payout_ratio": 0.1,
        "status": "active",
        "source": "defillama"
      }
    }
  },
  "balance_sheet": {
    "market_cap_usd": 233750740,
    "tvl_usd": 2109989088.5761566,
    "treasury_usd": null,
    "debt_usd": null
  },
  "valuation": {
    "pe": 151.0018,
    "ps": 15.1002,
    "pb": null,
    "ev_revenue": null,
    "payout_ratio": 0.1
  },
  "verification": {
    "method": "月收入 $1,290,000（判定书/官方仪表盘）×12 = 年化收入 $15,480,000；MIP-021 月收入 $1,290,000 < $1.5M → 10% 档 → 回购 $1,548,000（净利 × 10%）；留存 90%",
    "status": "partial",
    "last_checked": "2026-10-18"
  }
}